{
  "release_id": "33333333-3333-4333-8333-333333333333",
  "core_id": "22222222-2222-4222-8222-222222222222",
  "schema_version": "1.0.0",
  "title": "Test character",
  "display_name": "Ada",
  "pronouns": [
    "she",
    "her"
  ],
  "species": "human",
  "age_years": 27,
  "public_summary": "A cartographer who keeps her maps to herself.",
  "tags": [
    "adventure"
  ],
  "attribution": {
    "creator_display_name": "kdhunt"
  }
}
